{
  "schema_version": 1,
  "project_id": "iwato",
  "tile_size": 32,
  "screen_tiles": {
    "w": 20,
    "h": 11.25
  },
  "size_guideline_screens": {
    "min": 1.5,
    "max": 3.0,
    "exempt": [
      "F11"
    ]
  },
  "topology_constraints": [
    {
      "type": "exits_exactly",
      "field": "F09",
      "to": [
        "F03"
      ],
      "reason": "磐戸城址へは F03 の高架下隧道からのみ到達できる。高速で尾根が断たれており、他に道はない"
    },
    {
      "type": "exits_exactly",
      "field": "F08",
      "to": [
        "F07",
        "F16"
      ],
      "reason": "天神社へは F07 光明院裏手の石段からのみ入る。F16 は天神社より奥にあり、通り抜けの先にしか存在しない"
    },
    {
      "type": "gated_entry",
      "field": "F16",
      "reason": "薬師谷は禁域。終盤まで進入できない"
    },
    {
      "type": "choke_point",
      "field": "F09",
      "via": "F03",
      "from": "F06",
      "reason": "F03 を通らずに城址へ到達できてはならない"
    },
    {
      "type": "choke_point",
      "field": "F08",
      "via": "F07",
      "from": "F06",
      "reason": "F07 を通らずに天神社へ到達できてはならない"
    },
    {
      "type": "choke_point",
      "field": "F16",
      "via": "F08",
      "from": "F06",
      "reason": "F08 を通らずに薬師谷へ到達できてはならない"
    },
    {
      "type": "all_reachable",
      "from": "F06",
      "reason": "拠点である市民センターから全フィールドへ到達できること。孤立したフィールドを作らない"
    },
    {
      "type": "boundary",
      "field": "F15",
      "reason": "蒼籠川が南限。御渡橋が唯一の渡河点であり、町域外へ出る接続は存在しない（全ての exit が定義済みフィールドを指すことで担保される）"
    }
  ],
  "terrain_vocabulary": [
    {
      "key": "asphalt",
      "en": "a smooth uniform dark grey asphalt road surface, featureless and matte, no visible texture or markings",
      "ja": "ひび割れたアスファルト",
      "note": "cracked を外した。ひびは全タイルに複製される特徴である。**この文言は4回目の生成で実証済み。一字も変えないこと。** no visible texture or markings を落とした5回目でざらつきが 0.9→4.0 に後退した"
    },
    {
      "key": "concrete",
      "en": "a smooth poured concrete surface, featureless and matte, no visible texture or markings",
      "ja": "コンクリート舗装",
      "note": "pavement / expansion joints を外した。目地の目地を生む。asphalt と同じ実証済みの句を使う"
    },
    {
      "key": "concrete_curb",
      "en": "smooth pale concrete raised edge, matte and plain",
      "ja": "縁石と側溝・グレーチング",
      "note": "kerb / gutter / grating を外した。**sidewalk と同じ構造の含意**を持つ。グレーチングは deco へ"
    },
    {
      "key": "gravel",
      "en": "compacted grey gravel",
      "ja": "締まった砂利"
    },
    {
      "key": "bare_soil",
      "en": "dry packed bare earth",
      "ja": "乾いた地面"
    },
    {
      "key": "dry_grass",
      "en": "sun-scorched late-summer grass, low and even",
      "ja": "夏枯れのまだらな草",
      "note": "patchy を外した。斑は特徴である"
    },
    {
      "key": "overgrown_grass",
      "en": "tall overgrown summer weeds",
      "ja": "伸びきった夏草"
    },
    {
      "key": "stone_pavement",
      "en": "worn flagstone paving",
      "ja": "踏み減った石畳"
    },
    {
      "key": "moss_stone",
      "en": "old stone with dark moss",
      "ja": "苔むした古い石"
    },
    {
      "key": "stone_steps",
      "en": "weathered stone steps",
      "ja": "風化した石段"
    },
    {
      "key": "paddy_water",
      "en": "shallow still water, dark and calm",
      "ja": "水田の浅い水",
      "note": "rice paddy を外した。矩形の区画を含意する"
    },
    {
      "key": "paddy_ridge",
      "en": "a low narrow bank of packed earth, even",
      "ja": "畦",
      "note": "rice paddies を外した。同上"
    },
    {
      "key": "river_water",
      "en": "slow shallow river water",
      "ja": "浅く緩い川面"
    },
    {
      "key": "river_gravel",
      "en": "pale rounded river pebbles, evenly scattered",
      "ja": "河原の礫",
      "note": "bar（州）を外した"
    },
    {
      "key": "forest_floor",
      "en": "dark forest floor with fallen cedar needles",
      "ja": "杉の落葉が積もる林床"
    },
    {
      "key": "undergrowth",
      "en": "dense shaded undergrowth",
      "ja": "日陰の下草"
    },
    {
      "key": "tarmac_parking",
      "en": "a flat smooth asphalt surface, featureless and matte, no visible texture or markings",
      "ja": "駐車場の平らな舗装",
      "note": "parking lot を外した。駐車枠を含意する。白線は deco へ。実証済みの句を使う"
    },
    {
      "key": "tatami",
      "en": "worn tatami mat",
      "ja": "擦れた畳"
    },
    {
      "key": "wood_floor",
      "en": "dark worn wooden floorboards",
      "ja": "黒ずんだ板の間"
    },
    {
      "key": "linoleum",
      "en": "scuffed pale school linoleum floor",
      "ja": "傷んだリノリウム床"
    },
    {
      "key": "embankment_grass",
      "en": "mown grass embankment slope",
      "ja": "刈られた法面の草"
    },
    {
      "key": "concrete_frame",
      "en": "concrete slope framing grid",
      "ja": "法枠コンクリート"
    },
    {
      "key": "earthwork_grass",
      "en": "grassed earthwork rampart",
      "ja": "草に覆われた土塁"
    },
    {
      "key": "dry_moat",
      "en": "dry moat floor with leaf litter",
      "ja": "落葉の溜まった空堀の底"
    },
    {
      "key": "infield_soil",
      "en": "bare infield soil of a sports ground",
      "ja": "グラウンドの土"
    },
    {
      "key": "dead_orchard_soil",
      "en": "dry bare orchard ground, matte and even",
      "ja": "枯れた梅林の地面",
      "note": "beneath leafless plum trees を外した。**全タイルに木が生える**"
    },
    {
      "key": "ruin_stone",
      "en": "broken stone rubble, irregularly scattered",
      "ja": "崩れた礎石",
      "note": "foundation blocks を外した。石の単位を含意する"
    },
    {
      "key": "bridge_deck",
      "en": "asphalt bridge deck with steel expansion joint",
      "ja": "橋面と伸縮継手"
    },
    {
      "key": "tarmac_parking_light",
      "en": "a flat smooth asphalt surface, featureless and matte, no visible texture or markings, very slightly lighter",
      "ja": "駐車場の舗装（わずかに明るい）",
      "note": "分類Bの床タイル用。ほぼ同一2素材の組。16タイルを濃淡のバリエーションにする"
    },
    {
      "key": "wood_floor_light",
      "en": "dark worn wooden floorboards, very slightly lighter",
      "ja": "板張り（わずかに明るい）",
      "note": "同上"
    }
  ],
  "fields": [
    {
      "id": "F01",
      "name": "国道281号 沿道商業地区",
      "reading": "こくどう281ごう えんどうしょうぎょうちく",
      "world_pos": {
        "x_m": 150,
        "y_m": 900
      },
      "size_tiles": {
        "w": 30,
        "h": 22
      },
      "elevation": 82,
      "biome": "roadside_commercial",
      "horror_core": "明るすぎる安全地帯",
      "landmarks": [
        {
          "id": "supermarket",
          "name": "スーパー",
          "note": "夜も看板が灯る。町で最も明るい面"
        },
        {
          "id": "conveni",
          "name": "深夜のコンビニ",
          "note": "窓の光が駐車場を白く塗る。唯一の常時光源"
        },
        {
          "id": "kaiten_sushi",
          "name": "回転寿司",
          "note": "閉店後の暗い窓と、点きっぱなしの看板"
        },
        {
          "id": "drugstore",
          "name": "ドラッグストア",
          "note": ""
        },
        {
          "id": "wide_parking",
          "name": "広大な駐車場",
          "note": "白線だけが延々と続く。人がいないほど広い"
        }
      ],
      "interactables": [
        {
          "id": "conveni_door",
          "name": "コンビニの自動ドア",
          "asset": "obj_conveni_front",
          "note": ""
        },
        {
          "id": "vending_row",
          "name": "自動販売機の列",
          "asset": "obj_vending_machine",
          "note": "本作で最も彩度の高い光源。ここだけ色が許される"
        },
        {
          "id": "parking_notice",
          "name": "駐車場の掲示",
          "asset": "obj_signboard_pole",
          "note": ""
        }
      ],
      "required_tiles": [
        {
          "id": "tile_asphalt_curb",
          "label": "アスファルトと縁石・側溝",
          "lower": "asphalt",
          "upper": "concrete_curb",
          "transition": null,
          "shared": true
        },
        {
          "id": "tile_parking_line",
          "label": "駐車場と白線",
          "lower": "tarmac_parking",
          "upper": "tarmac_parking_light",
          "transition": null,
          "shared": true
        },
        {
          "id": "tile_asphalt_grass",
          "label": "アスファルトと夏枯れの草",
          "lower": "asphalt",
          "upper": "dry_grass",
          "transition": "bare_soil",
          "shared": true
        }
      ],
      "required_objects": [
        "obj_vending_machine",
        "obj_utility_pole",
        "obj_street_light_mercury",
        "obj_guardrail",
        "obj_road_mirror",
        "obj_traffic_cone",
        "obj_signboard_pole",
        "obj_conveni_front",
        "obj_shop_facade_roadside",
        "obj_kei_car",
        "ovh_power_line",
        "ovh_shop_awning"
      ],
      "ambience": "車の走行音が絶えない。虫の声より人工音が勝つ。町で唯一、夜に音がある場所",
      "time_variants": [
        "day",
        "dusk",
        "night"
      ],
      "content_constraints": [],
      "exits": [
        {
          "to": "F02",
          "via": "国道281号 北行き",
          "kind": "road",
          "gated": false
        },
        {
          "to": "F05",
          "via": "旧街道への連絡路",
          "kind": "alley",
          "gated": false
        },
        {
          "to": "F12",
          "via": "国道281号 南行き",
          "kind": "road",
          "gated": false
        }
      ]
    },
    {
      "id": "F02",
      "name": "於御所住宅地",
      "reading": "おごそじゅうたくち",
      "world_pos": {
        "x_m": 450,
        "y_m": 450
      },
      "size_tiles": {
        "w": 26,
        "h": 22
      },
      "elevation": 95,
      "biome": "residential_showa",
      "horror_core": "生活が途中で止まっている",
      "landmarks": [
        {
          "id": "friend_house",
          "name": "親友の家",
          "note": "本作の中心。外観は他の家と全く同じであること。特別に見せない"
        },
        {
          "id": "old_hermitage",
          "name": "古い庵",
          "note": "住宅地に一軒だけ残る古い建物"
        },
        {
          "id": "narrow_slope",
          "name": "於御所の坂",
          "note": ""
        },
        {
          "id": "block_wall_alley",
          "name": "ブロック塀の路地",
          "note": ""
        }
      ],
      "interactables": [
        {
          "id": "friend_room",
          "name": "親友の部屋",
          "asset": "obj_room_interior_stopped",
          "note": "生活が途中で止まった部屋としてのみ描く。死を示す物を一切置かない"
        },
        {
          "id": "mailbox_full",
          "name": "溜まった郵便受け",
          "asset": "obj_mailbox",
          "note": ""